[
  {
    "id": "rain_today_skip_watering",
    "active": "yes",
    "section": "wait",
    "condition_logic": "all",
    "metric_1": "precipitation_sum",
    "operator_1": ">=",
    "value_1": 3,
    "metric_2": "",
    "operator_2": "",
    "value_2": "",
    "unit": "mm",
    "forecast_day_offset": 0,
    "lookback_days": 0,
    "severity": "medium",
    "title": "Zalivanje danes verjetno ni potrebno",
    "short_message": "Napovedan je dež, zato najprej preveri vlažnost tal.",
    "detail": "Pri dežju ne zalivaj avtomatično. Lonci pod streho so izjema, ker jih dež pogosto ne doseže.",
    "recommended_action": "Preveri zemljo s prstom; zalij samo suhe lonce ali pokrite dele.",
    "avoid_action": "Ne zalivaj celotnega vrta po urniku, če je zemlja že mokra.",
    "applies_months": "3,4,5,6,7,8,9,10",
    "applies_garden_types": "vrt,visoka_greda,balkon,rastlinjak",
    "applies_task_types": "watering",
    "plant_group_tags": "all",
    "confidence": "high",
    "source_ids": "open_meteo_docs",
    "ui_badge": "dež",
    "sort_weight": 95
  },
  {
    "id": "heavy_rain_avoid_soil_work",
    "active": "yes",
    "section": "wait",
    "condition_logic": "all",
    "metric_1": "precipitation_sum",
    "operator_1": ">=",
    "value_1": 15,
    "metric_2": "",
    "operator_2": "",
    "value_2": "",
    "unit": "mm",
    "forecast_day_offset": 0,
    "lookback_days": 0,
    "severity": "high",
    "title": "Ne delaj po mokri zemlji",
    "short_message": "Močnejši dež lahko zbije tla in oteži delo na gredah.",
    "detail": "Po močnem dežju je bolje počakati, da se tla odcedijo. Delo v premokri zemlji lahko pokvari strukturo tal.",
    "recommended_action": "Preveri odvodnjavanje, lonce in mlade sadike.",
    "avoid_action": "Ne rahljaj, ne prekopavaj in ne hodi po mokri gredi.",
    "applies_months": "1,2,3,4,5,6,7,8,9,10,11,12",
    "applies_garden_types": "vrt,visoka_greda",
    "applies_task_types": "soil_prep,sowing_outdoor,transplanting",
    "plant_group_tags": "all",
    "confidence": "medium",
    "source_ids": "open_meteo_docs",
    "ui_badge": "mokra tla",
    "sort_weight": 98
  },
  {
    "id": "heavy_rain_protect_containers",
    "active": "yes",
    "section": "watch",
    "condition_logic": "all",
    "metric_1": "precipitation_sum",
    "operator_1": ">=",
    "value_1": 15,
    "metric_2": "",
    "operator_2": "",
    "value_2": "",
    "unit": "mm",
    "forecast_day_offset": 0,
    "lookback_days": 0,
    "severity": "medium",
    "title": "Preveri lonce in korita",
    "short_message": "Ob močnem dežju se lahko lonci preveč namočijo.",
    "detail": "Balkonske posode morajo imeti odtočne luknje. Če voda stoji, korenine trpijo.",
    "recommended_action": "Premakni občutljive lonce pod streho ali preveri odtekanje vode.",
    "avoid_action": "Ne pusti loncev stati v podstavkih, polnih vode.",
    "applies_months": "3,4,5,6,7,8,9,10",
    "applies_garden_types": "balkon",
    "applies_task_types": "protection,watering",
    "plant_group_tags": "herbs,leafy,fruiting",
    "confidence": "high",
    "source_ids": "open_meteo_docs",
    "ui_badge": "lonci",
    "sort_weight": 85
  },
  {
    "id": "rain_tomorrow_harvest_before",
    "active": "yes",
    "section": "today",
    "condition_logic": "all",
    "metric_1": "precipitation_sum",
    "operator_1": ">=",
    "value_1": 8,
    "metric_2": "",
    "operator_2": "",
    "value_2": "",
    "unit": "mm",
    "forecast_day_offset": 1,
    "lookback_days": 0,
    "severity": "low",
    "title": "Obiraj zrele pridelke pred dežjem",
    "short_message": "Če je jutri dež, se danes splača pobrati zrele plodove in zelišča.",
    "detail": "Zreli plodovi lahko po dežju pokajo ali hitreje propadajo. Pri zeliščih je za sušenje boljše suho vreme.",
    "recommended_action": "Poberi zrele paradižnike, jagode, bučke, solato ali zelišča, če so pripravljeni.",
    "avoid_action": "Ne pobiraj nezrelih pridelkov samo zaradi napovedi.",
    "applies_months": "5,6,7,8,9,10",
    "applies_garden_types": "vrt,visoka_greda,balkon",
    "applies_task_types": "harvesting",
    "plant_group_tags": "fruiting,leafy,herbs,berries",
    "confidence": "medium",
    "source_ids": "open_meteo_docs",
    "ui_badge": "pred dežjem",
    "sort_weight": 70
  },
  {
    "id": "dry_3d_water_priority",
    "active": "yes",
    "section": "today",
    "condition_logic": "all",
    "metric_1": "precipitation_3d",
    "operator_1": "<",
    "value_1": 2,
    "metric_2": "temperature_max",
    "operator_2": ">=",
    "value_2": 24,
    "unit": "mm/°C",
    "forecast_day_offset": 0,
    "lookback_days": 3,
    "severity": "medium",
    "title": "Preveri zalivanje",
    "short_message": "Več dni je suho in toplo, zato preveri vlažnost tal.",
    "detail": "Visoke grede in lonci se izsušijo hitreje kot klasične grede. Zalivanje prilagodi dejanski vlažnosti zemlje.",
    "recommended_action": "Zalivaj zjutraj ali zvečer, predvsem lonce, visoke grede in plodovke.",
    "avoid_action": "Ne zalivaj po listih sredi dneva.",
    "applies_months": "4,5,6,7,8,9",
    "applies_garden_types": "vrt,visoka_greda,balkon",
    "applies_task_types": "watering",
    "plant_group_tags": "fruiting,leafy,herbs,berries",
    "confidence": "high",
    "source_ids": "open_meteo_docs",
    "ui_badge": "suho",
    "sort_weight": 100
  },
  {
    "id": "dry_7d_mulch_recommended",
    "active": "yes",
    "section": "this_week",
    "condition_logic": "all",
    "metric_1": "precipitation_7d",
    "operator_1": "<",
    "value_1": 5,
    "metric_2": "temperature_max",
    "operator_2": ">=",
    "value_2": 25,
    "unit": "mm/°C",
    "forecast_day_offset": 0,
    "lookback_days": 7,
    "severity": "medium",
    "title": "Dodaj zastirko",
    "short_message": "Ob suhem tednu zastirka pomaga zadržati vlago.",
    "detail": "Zastirka zmanjša izhlapevanje, blaži nihanja temperature tal in zavira plevel.",
    "recommended_action": "Okoli paradižnika, bučk, jagod in visokih gred dodaj tanko plast primerne zastirke.",
    "avoid_action": "Ne nalagaj debele mokre zastirke neposredno ob steblo.",
    "applies_months": "5,6,7,8,9",
    "applies_garden_types": "vrt,visoka_greda",
    "applies_task_types": "mulching,watering",
    "plant_group_tags": "fruiting,berries",
    "confidence": "medium",
    "source_ids": "open_meteo_docs,arso_agromet_drought",
    "ui_badge": "zastirka",
    "sort_weight": 65
  },
  {
    "id": "hot_day_watering_timing",
    "active": "yes",
    "section": "today",
    "condition_logic": "all",
    "metric_1": "temperature_max",
    "operator_1": ">=",
    "value_1": 28,
    "metric_2": "",
    "operator_2": "",
    "value_2": "",
    "unit": "°C",
    "forecast_day_offset": 0,
    "lookback_days": 0,
    "severity": "medium",
    "title": "Zalivaj zgodaj ali zvečer",
    "short_message": "Vroč dan ni primeren za zalivanje po listih sredi dneva.",
    "detail": "Pri visokih temperaturah je bolje zalivati zjutraj ali zvečer, ob korenini.",
    "recommended_action": "Zalij občutljive rastline pred vročino ali po sončnem zahodu.",
    "avoid_action": "Ne moči listov sredi dneva, če ni nujno.",
    "applies_months": "5,6,7,8,9",
    "applies_garden_types": "vrt,visoka_greda,balkon",
    "applies_task_types": "watering",
    "plant_group_tags": "all",
    "confidence": "high",
    "source_ids": "open_meteo_docs",
    "ui_badge": "vroče",
    "sort_weight": 98
  },
  {
    "id": "very_hot_avoid_transplanting",
    "active": "yes",
    "section": "wait",
    "condition_logic": "all",
    "metric_1": "temperature_max",
    "operator_1": ">=",
    "value_1": 32,
    "metric_2": "",
    "operator_2": "",
    "value_2": "",
    "unit": "°C",
    "forecast_day_offset": 0,
    "lookback_days": 0,
    "severity": "high",
    "title": "Presajanje raje prestavi",
    "short_message": "Zelo vroč dan je stresen za sadike.",
    "detail": "Mlade sadike se v vročini hitreje izsušijo in lažje ovenijo. Če moraš presajati, izberi večer in dobro zalij.",
    "recommended_action": "Presajanje prestavi na hladnejši dan ali večer.",
    "avoid_action": "Ne presajaj opoldne ali v največji vročini.",
    "applies_months": "5,6,7,8,9",
    "applies_garden_types": "vrt,visoka_greda,balkon",
    "applies_task_types": "transplanting,planting",
    "plant_group_tags": "fruiting,leafy,brassicas,herbs",
    "confidence": "high",
    "source_ids": "open_meteo_docs",
    "ui_badge": "vročinski stres",
    "sort_weight": 99
  },
  {
    "id": "heatwave_3d_extra_care",
    "active": "yes",
    "section": "watch",
    "condition_logic": "all",
    "metric_1": "hot_days_3d",
    "operator_1": ">=",
    "value_1": 3,
    "metric_2": "",
    "operator_2": "",
    "value_2": "",
    "unit": "days",
    "forecast_day_offset": 0,
    "lookback_days": 3,
    "severity": "high",
    "title": "Vročinski niz dni",
    "short_message": "Več vročih dni zapored poveča potrebo po vodi in senci.",
    "detail": "Pri loncih, visokih gredah in plodovkah spremljaj venenje, suho zemljo in ožige.",
    "recommended_action": "Zalivaj pogosteje, uporabi zastirko in po potrebi začasno senčenje.",
    "avoid_action": "Ne dodajaj močnega gnojila v času vročinskega stresa.",
    "applies_months": "6,7,8,9",
    "applies_garden_types": "vrt,visoka_greda,balkon,rastlinjak",
    "applies_task_types": "watering,protection,mulching",
    "plant_group_tags": "all",
    "confidence": "medium",
    "source_ids": "open_meteo_docs",
    "ui_badge": "vročinski niz",
    "sort_weight": 93
  },
  {
    "id": "cold_night_protect_seedlings",
    "active": "yes",
    "section": "watch",
    "condition_logic": "all",
    "metric_1": "temperature_min",
    "operator_1": "<",
    "value_1": 5,
    "metric_2": "",
    "operator_2": "",
    "value_2": "",
    "unit": "°C",
    "forecast_day_offset": 0,
    "lookback_days": 0,
    "severity": "medium",
    "title": "Hladna noč za občutljive sadike",
    "short_message": "Občutljive rastline spremljaj in po potrebi zaščiti.",